cluster_p.csv

cluster,count,avg_age,avg_capital_gain,avg_capital_loss,avg_hours,most_common_workclass,most_common_occupation,pct_over_50K,cluster_name
1,3787,43.68,8.84,0.0,43.9,Private,Prof-specialty,63.0,Capital_Gain_Winners
2,2140,41.79,0.0,7.51,43.6,Private,Exec-managerial,51.0,Risk_Takers
0,39248,37.89,0.0,0.0,40.42,Private,Craft-repair,20.0,Nine_to_Five

README.md

## 9. Exploratory Data Analysis (EDA)

Clustering - Micro Level (Individuals):
Features: age, hours-per-week, capital-gain/loss
KMeans, k=3
Cluster 0 - Nine-to-Five (87%): 37.9 yrs, 40.4 hrs, 0 capital gain. Only 19.7% >50K
Cluster 1 - Capital-gain-winners (8.4%): 43.7 yrs, 43.9 hrs, 8.84 avg capital gain. 62.7% >50K
Cluster 2 - Risk-Takers (4.7%): 41.8 yrs, 43.6 hrs, 7.51 avg capital loss, 0 gain. 51.3% >50K